[{"id":"pc-001","name":"Pikachu","set_code":"pc","pack":"Promo-C","type":"Pokémon","subtype":"Lightning","stage":"Basic","rarity":"Promo","ex":false,"mega":false,"health":60,"points":1,"deckBuilderNr":0,"image":"https://raw.githubusercontent.com/PocketDecks/pokemon-tcg-pocket-cards/refs/heads/main/images/webp/cards/pc/001.webp"},{"id":"pc-002","name":"Mega Mewtwo Y ex","set_code":"pc","pack":"Promo-C","type":"Pokémon","subtype":"Psychic","stage":"Basic","rarity":"Promo","ex":true,"mega":true,"health":170,"points":3,"deckBuilderNr":0,"image":"https://raw.githubusercontent.com/PocketDecks/pokemon-tcg-pocket-cards/refs/heads/main/images/webp/cards/pc/002.webp"},{"id":"pc-003","name":"Deoxys","set_code":"pc","pack":"Promo-C","type":"Pokémon","subtype":"Psychic","stage":"Basic","rarity":"Promo","ex":false,"mega":false,"health":100,"points":1,"deckBuilderNr":0,"image":"https://raw.githubusercontent.com/PocketDecks/pokemon-tcg-pocket-cards/refs/heads/main/images/webp/cards/pc/003.webp"},{"id":"pc-004","name":"Inkay","set_code":"pc","pack":"Promo-C","type":"Pokémon","subtype":"Psychic","stage":"Basic","rarity":"Promo","ex":false,"mega":false,"health":60,"points":1,"deckBuilderNr":0,"image":"https://raw.githubusercontent.com/PocketDecks/pokemon-tcg-pocket-cards/refs/heads/main/images/webp/cards/pc/004.webp"},{"id":"pc-005","name":"Malamar","set_code":"pc","pack":"Promo-C","type":"Pokémon","subtype":"Psychic","stage":"Stage 1","rarity":"Promo","ex":false,"mega":false,"health":90,"points":1,"deckBuilderNr":0,"image":"https://raw.githubusercontent.com/PocketDecks/pokemon-tcg-pocket-cards/refs/heads/main/images/webp/cards/pc/005.webp"},{"id":"pc-006","name":"Cosmog","set_code":"pc","pack":"Promo-C","type":"Pokémon","subtype":"Psychic","stage":"Basic","rarity":"Promo","ex":false,"mega":false,"health":60,"points":1,"deckBuilderNr":0,"image":"https://raw.githubusercontent.com/PocketDecks/pokemon-tcg-pocket-cards/refs/heads/main/images/webp/cards/pc/006.webp"},{"id":"pc-007","name":"Cosmoem","set_code":"pc","pack":"Promo-C","type":"Pokémon","subtype":"Psychic","stage":"Stage 1","rarity":"Promo","ex":false,"mega":false,"health":100,"points":1,"deckBuilderNr":0,"image":"https://raw.githubusercontent.com/PocketDecks/pokemon-tcg-pocket-cards/refs/heads/main/images/webp/cards/pc/007.webp"},{"id":"pc-008","name":"Lunala","set_code":"pc","pack":"Promo-C","type":"Pokémon","subtype":"Psychic","stage":"Stage 2","rarity":"Promo","ex":false,"mega":false,"health":150,"points":1,"deckBuilderNr":0,"image":"https://raw.githubusercontent.com/PocketDecks/pokemon-tcg-pocket-cards/refs/heads/main/images/webp/cards/pc/008.webp"},{"id":"pc-009","name":"Genome Converter Y","set_code":"pc","pack":"Promo-C","type":"Trainer","subtype":"Item","rarity":"Promo","deckBuilderNr":0,"image":"https://raw.githubusercontent.com/PocketDecks/pokemon-tcg-pocket-cards/refs/heads/main/images/webp/cards/pc/009.webp"},{"id":"pc-010","name":"Stantler","set_code":"pc","pack":"Promo-C","type":"Pokémon","subtype":"Colorless","stage":"Basic","rarity":"Promo","ex":false,"mega":false,"health":80,"points":1,"deckBuilderNr":0,"image":"https://raw.githubusercontent.com/PocketDecks/pokemon-tcg-pocket-cards/refs/heads/main/images/webp/cards/pc/010.webp"},{"id":"pc-011","name":"Alcremie","set_code":"pc","pack":"Promo-C","type":"Pokémon","subtype":"Psychic","stage":"Stage 1","rarity":"Promo","ex":false,"mega":false,"health":80,"points":1,"deckBuilderNr":0,"image":"https://raw.githubusercontent.com/PocketDecks/pokemon-tcg-pocket-cards/refs/heads/main/images/webp/cards/pc/011.webp"},{"id":"pc-012","name":"Delibird","set_code":"pc","pack":"Promo-C","type":"Pokémon","subtype":"Water","stage":"Basic","rarity":"Promo","ex":false,"mega":false,"health":80,"points":1,"deckBuilderNr":0,"image":"https://raw.githubusercontent.com/PocketDecks/pokemon-tcg-pocket-cards/refs/heads/main/images/webp/cards/pc/012.webp"},{"id":"pc-013","name":"Mega Dragonite ex","set_code":"pc","pack":"Promo-C","type":"Pokémon","subtype":"Dragon","stage":"Stage 2","rarity":"Promo","ex":true,"mega":true,"health":240,"points":3,"deckBuilderNr":0,"image":"https://raw.githubusercontent.com/PocketDecks/pokemon-tcg-pocket-cards/refs/heads/main/images/webp/cards/pc/013.webp"}]